<?xml version='1.0' encoding='utf-8'?>
<!DOCTYPE document SYSTEM "screenplay-xml.dtd">
<document xmlns="http://web-cpan.berlios.de/modules/XML-Grammar-Screenplay/screenplay-xml-0.2/">
    <head>
    </head>
    <body id="index">
<scene id="top">
    <scene id="david_and_goliath">
        <description>
            <para>
                David and 
                <ulink url="http://en.wikipedia.org/wiki/Goliath">Goliath</ulink> 
                are standing by each other.
            </para>
        </description>
        <saying character="David">
            <para>
                I will kill you.
            </para>
        </saying>
        <saying character="Goliath">
            <para>
                no way, you little idiot!
            </para>
        </saying>
        <saying character="David">
            <para>
                yes way!
            </para>
            <para>
                In the name of <ulink url="http://real-allah.tld/">Allah, the <bold>merciful</bold>, real merciful</ulink>, I will show you the 
                <inlinedesc>sarcastically</inlinedesc> power 
                of my sling.
            </para>
            <para>
                I shall sling you and bing you till infinity.
            </para>
        </saying>
        <description>
            <para>
                David takes his sling.
            </para>
        </description>
    <saying character="Goliath">
        <para>
            I'm still <ulink url="http://wait.tld/">waiting</ulink>.
        </para>
    </saying>
    <saying character="David">
        <para>
            so you are.
        </para>
    </saying>
    <description>
        <para>
            David puts a stone in his sling and shoots Goliath. He hits.
        </para>
    </description>
    <saying character="David">
        <para>
            as is written in the wikipedia <inlinedesc>See <ulink url="http://wiki.tld/">the Wiki site</ulink>
                for more information</inlinedesc>, you are now dead,
            having been shot with my sling.
        </para>
    </saying>
</scene>
</scene>
</body>
</document>
