<?xml version='1.0' encoding='utf-8'?>
<!DOCTYPE document SYSTEM "screenplay-xml.dtd">
<document xmlns="http://web-cpan.berlios.de/modules/XML-Grammar-Screenplay/screenplay-xml-0.2/">
    <head>
    </head>
    <body id="index">
<scene id="top">
    <scene id="david_and_goliath">
        <description>
            <para>
                David and 
                <ulink url="http://en.wikipedia.org/wiki/Goliath">Goliath</ulink> 
                are standing by each other.
            </para>
        </description>
        <saying character="David">
            <para>
                I will kill you.<br />
                I will kill you.<br />
                You will not survive.<br />
                I will kill you.<br />
                I will kill you.<br />
                Ask Jive.
            </para>
        </saying>
        <saying character="Goliath">
            <para>
                no way, you little idiot!
            </para>
        </saying>
        <saying character="David">
            <para>
                yes way!
            </para>
        </saying>
</scene>
</scene>
</body>
</document>
